{
  "contractVersion": "1.0.0",
  "requestId": "55555555-5555-4555-8555-555555555555",
  "querySpecHash": "sha256:e3b0c44298fc1c149afbf4c8996fb92427ae41e4649b934ca495991b7852b855",
  "presentationHint": "FORM",
  "channelProfile": "WEB_RICH_V1",
  "locale": "en-US",
  "interactionMode": "GOVERNANCE_DRAFT",
  "workflowId": "forecast_governance_draft"
}
